<!ELEMENT PORTFOLIO (COMPENETCIES)+>
<!ELEMENT COMPETENCIES (COMPETENCY)+>
<!ELEMENT COMPETENCY EMPTY>

<!ATTLIST PORTFOLIO OWNER CDATA #IMPLIED>
<!ATTLIST COMPETENCY 
	IN CDATA #REQUIRED
	VALUE CDATA #REQUIRED
>